{
  "$schema": "https://json-schema.org/draft/2020-12/schema",
  "$id": "https://hellochapter.com/schemas/chapter-capture/v1/manifest.schema.json",
  "title": "PackageManifest",
  "description": "Inventory of one sealed intake package for one site visit: one entry per file with its role, SHA-256 fingerprint, size, type and provenance. Written at sealing as Source Register/{visitId}/manifest.json (see layout.json); the manifest does not list itself. Paths are unique within the manifest. Files that belong to one capture carry its captureId and areaKey; visit-wide files (capture_record, field_controls) carry neither. A changed package is a new revision with a new packageId. Optional fields are omitted, never null.",
  "type": "object",
  "additionalProperties": false,
  "required": [
    "schemaVersion",
    "layoutVersion",
    "packageId",
    "visitId",
    "revision",
    "sealedAt",
    "files"
  ],
  "properties": {
    "schemaVersion": {
      "description": "1.1.0 adds the optional photo.directionSource and retires the role spatial_report_pdf; 1.2.0 adds the roles sketch_image and sketch_measurements (spec F14) and walkthrough_video and walkthrough_log (spec F15). A 1.0.0 document does not carry directionSource; a 1.1.0 or 1.2.0 document lists no spatial_report_pdf file; only a 1.2.0 document lists a sketch or walkthrough role. Readers accept every version; writers write 1.2.0.",
      "enum": ["1.0.0", "1.1.0", "1.2.0"]
    },
    "layoutVersion": {
      "description": "Version of contract/schema/layout.json the paths follow.",
      "const": "1.0.0"
    },
    "packageId": {
      "$ref": "#/$defs/uuid"
    },
    "visitId": {
      "$ref": "#/$defs/uuid"
    },
    "revision": {
      "description": "Package revision for this visit, starting at 1.",
      "type": "integer",
      "minimum": 1
    },
    "supersedesPackageId": {
      "description": "packageId of the previous revision. Present only when revision is greater than 1.",
      "$ref": "#/$defs/uuid"
    },
    "sealedAt": {
      "$ref": "#/$defs/dateTime"
    },
    "files": {
      "type": "array",
      "minItems": 1,
      "items": {
        "$ref": "#/$defs/fileEntry"
      }
    }
  },
  "if": {
    "properties": {
      "revision": {
        "const": 1
      }
    }
  },
  "then": {
    "not": {
      "properties": {
        "supersedesPackageId": {
          "$ref": "#/$defs/uuid"
        }
      },
      "required": ["supersedesPackageId"]
    }
  },
  "else": {
    "properties": {
      "supersedesPackageId": {
        "$ref": "#/$defs/uuid"
      }
    },
    "required": ["supersedesPackageId"]
  },
  "allOf": [
    {
      "if": {
        "properties": {
          "schemaVersion": {
            "const": "1.0.0"
          }
        }
      },
      "then": {
        "description": "A 1.0.0 document carries none of the fields added in 1.1.0 and lists no role added in 1.2.0.",
        "properties": {
          "files": {
            "type": "array",
            "items": {
              "type": "object",
              "properties": {
                "photo": {
                  "type": "object",
                  "properties": {
                    "directionSource": false
                  }
                },
                "role": {
                  "not": {
                    "enum": [
                      "sketch_image",
                      "sketch_measurements",
                      "walkthrough_video",
                      "walkthrough_log",
                      "sketch_interpretation"
                    ]
                  }
                }
              }
            }
          }
        }
      }
    },
    {
      "if": {
        "properties": {
          "schemaVersion": {
            "const": "1.1.0"
          }
        }
      },
      "then": {
        "description": "A 1.1.0 document lists no file with a retired role and no role added in 1.2.0.",
        "properties": {
          "files": {
            "type": "array",
            "items": {
              "type": "object",
              "properties": {
                "role": {
                  "not": {
                    "enum": [
                      "spatial_report_pdf",
                      "sketch_image",
                      "sketch_measurements",
                      "walkthrough_video",
                      "walkthrough_log",
                      "sketch_interpretation"
                    ]
                  }
                }
              }
            }
          }
        }
      }
    },
    {
      "if": {
        "properties": {
          "schemaVersion": {
            "const": "1.2.0"
          }
        }
      },
      "then": {
        "description": "A 1.2.0 document lists no file with a retired role.",
        "properties": {
          "files": {
            "type": "array",
            "items": {
              "type": "object",
              "properties": {
                "role": {
                  "not": {
                    "enum": ["spatial_report_pdf"]
                  }
                }
              }
            }
          }
        }
      }
    }
  ],
  "$defs": {
    "uuid": {
      "description": "Lowercase RFC 9562 UUID.",
      "type": "string",
      "format": "uuid",
      "pattern": "^[0-9a-f]{8}-[0-9a-f]{4}-[0-9a-f]{4}-[0-9a-f]{4}-[0-9a-f]{12}$"
    },
    "dateTime": {
      "description": "UTC timestamp, whole seconds, RFC 3339 with Z.",
      "type": "string",
      "format": "date-time",
      "pattern": "^[0-9]{4}-[0-9]{2}-[0-9]{2}T[0-9]{2}:[0-9]{2}:[0-9]{2}Z$"
    },
    "areaKey": {
      "description": "Key of the floor or area in the capture record, for example floor-1.",
      "type": "string",
      "pattern": "^[a-z0-9]+(-[a-z0-9]+)*$",
      "maxLength": 64
    },
    "relativePath": {
      "description": "Path relative to the package root, forward slashes, no '.' or '..' segments.",
      "type": "string",
      "minLength": 1,
      "maxLength": 1024,
      "pattern": "^(?!/)(?!.*//)(?!.*/$)(?!(.*/)?\\.{1,2}(/|$))[^\\\\\\x00-\\x1f]+$"
    },
    "role": {
      "description": "Closed set of file roles from the intake guide, plus capture_model (the normalized CaptureModel JSON of one capture) and, since 1.2.0, sketch_image (the photo, image or PDF of the hand sketch or existing plan a sketch capture was measured from) and sketch_measurements (the measurements the operator entered, sketch-measurements.schema.json), walkthrough_video (the camera video of an AR walkthrough) and walkthrough_log (its taps and camera poses, walkthrough-log.schema.json) and sketch_interpretation (what Claude read from a sketch photo, sketch-interpretation.schema.json, spec F16). Each role belongs to exactly one folder in layout.json. spatial_report_pdf is retired: written only in manifest 1.0.0 by app builds before v2; never in 1.1.0 or later. The spatial report is a station output, not a package file.",
      "enum": [
        "capture_record",
        "raw_roomplan_json",
        "raw_depth",
        "capture_model",
        "plan_dxf",
        "rooms_csv",
        "plan_pdf",
        "spatial_report_pdf",
        "plan_png",
        "plan_svg",
        "mesh_glb",
        "mesh_obj",
        "mesh_mtl",
        "texture",
        "point_cloud_las",
        "photo",
        "field_controls",
        "sketch_image",
        "sketch_measurements",
        "walkthrough_video",
        "walkthrough_log",
        "sketch_interpretation"
      ]
    },
    "visitRole": {
      "description": "Roles of visit-wide files. Every other role belongs to one capture.",
      "enum": ["capture_record", "field_controls"]
    },
    "photoDirection": {
      "description": "Direction the camera was looking.",
      "enum": ["N", "E", "S", "W"]
    },
    "photoSubject": {
      "enum": ["opening", "cabinetry", "ceiling", "fixture", "equipment", "defect", "general"]
    },
    "photo": {
      "description": "Labels of a site photograph.",
      "type": "object",
      "additionalProperties": false,
      "required": ["room", "direction", "subject", "takenAt"],
      "properties": {
        "room": {
          "description": "Room label, matching the capture model room label.",
          "type": "string",
          "minLength": 1,
          "maxLength": 100
        },
        "direction": {
          "$ref": "#/$defs/photoDirection"
        },
        "subject": {
          "$ref": "#/$defs/photoSubject"
        },
        "takenAt": {
          "$ref": "#/$defs/dateTime"
        },
        "directionSource": {
          "description": "How direction was set. compass: pre-filled from the phone's compass when the photo was taken and kept by the operator. manual: chosen or changed by the operator. Absent in 1.0.0 documents.",
          "enum": ["compass", "manual"]
        }
      }
    },
    "fileEntry": {
      "type": "object",
      "additionalProperties": false,
      "required": [
        "path",
        "role",
        "sha256",
        "bytes",
        "mime",
        "generator",
        "generatorVersion",
        "derivedFrom"
      ],
      "properties": {
        "path": {
          "$ref": "#/$defs/relativePath"
        },
        "role": {
          "$ref": "#/$defs/role"
        },
        "captureId": {
          "description": "Capture the file belongs to. Required for every role except capture_record and field_controls, which must omit it.",
          "$ref": "#/$defs/uuid"
        },
        "areaKey": {
          "description": "Floor or area key of that capture. Present exactly when captureId is.",
          "$ref": "#/$defs/areaKey"
        },
        "sha256": {
          "description": "Lowercase hex SHA-256 of the file bytes.",
          "type": "string",
          "pattern": "^[0-9a-f]{64}$"
        },
        "bytes": {
          "type": "integer",
          "minimum": 0
        },
        "mime": {
          "type": "string",
          "pattern": "^[a-z0-9][a-z0-9!#$&^_.+-]*/[a-z0-9][a-z0-9!#$&^_.+-]*$",
          "maxLength": 127
        },
        "generator": {
          "description": "Component that wrote the file, for example chapter-capture-ios/PlanExport.",
          "type": "string",
          "minLength": 1,
          "maxLength": 100
        },
        "generatorVersion": {
          "type": "string",
          "minLength": 1,
          "maxLength": 50
        },
        "derivedFrom": {
          "description": "Paths of the package files this file was derived from. Empty for originals.",
          "type": "array",
          "uniqueItems": true,
          "items": {
            "$ref": "#/$defs/relativePath"
          }
        },
        "photo": {
          "$ref": "#/$defs/photo"
        }
      },
      "allOf": [
        {
          "if": {
            "required": ["role"],
            "properties": {
              "role": {
                "$ref": "#/$defs/visitRole"
              }
            }
          },
          "then": {
            "not": {
              "anyOf": [
                {
                  "properties": {
                    "captureId": {
                      "$ref": "#/$defs/uuid"
                    }
                  },
                  "required": ["captureId"]
                },
                {
                  "properties": {
                    "areaKey": {
                      "$ref": "#/$defs/areaKey"
                    }
                  },
                  "required": ["areaKey"]
                }
              ]
            }
          },
          "else": {
            "properties": {
              "captureId": {
                "$ref": "#/$defs/uuid"
              },
              "areaKey": {
                "$ref": "#/$defs/areaKey"
              }
            },
            "required": ["captureId", "areaKey"]
          }
        },
        {
          "if": {
            "required": ["role"],
            "properties": {
              "role": {
                "const": "photo"
              }
            }
          },
          "then": {
            "properties": {
              "photo": {
                "$ref": "#/$defs/photo"
              }
            },
            "required": ["photo"]
          },
          "else": {
            "not": {
              "properties": {
                "photo": {
                  "$ref": "#/$defs/photo"
                }
              },
              "required": ["photo"]
            }
          }
        }
      ]
    }
  }
}
